timestamp,project_name,industry,tags,stage,score,summary,risk_level
2026-01-09 16:00:46,北京意加智能科技有限公司,脑机接口,非侵入式脑机接口;柔性石墨烯电极;运动想象解码;SSVEP;医疗康复,Angel,7,技术路径差异化明确的脑机接口上游方案商，团队商业能力强，但医疗级落地与产品可靠性面临重大验证挑战。,High
2026-01-09 16:47:01,西安汉克布特智能科技有限公司（AI织物瑕疵检测）,工业AI视觉检测/工业自动化,机器视觉;深度学习;行业大模型;边缘计算;智能制造,Pre-A轮,7,团队务实、客户痛点真实、解决方案有效的垂直工业AI应用，但市场天花板有限，估值空间取决于其横向平台化拓展能力。,Medium
2026-01-09 16:48:26,AI安全与隐私保护（赛道分析）,人工智能安全,对抗攻击;大模型安全;隐私计算;AI治理;可解释AI,未披露,7,监管与技术拐点催生的战略赛道，但需穿透“假原生”泡沫，投资于深嵌垂直行业、具备顶尖攻防能力的团队。,High
2026-01-09 16:50:09,意图驱动网络智能编排管控系统,网络通信软件/自智网络（Autonomous Network）,意图驱动网络;AI网络编排;LLM;知识图谱;6G;网络数字孪生;SaaS,未披露（科研项目阶段）,7,技术深厚的国家队项目，AI原生性强，但缺乏商业化基因与团队，投资取决于能否成功嫁接商业引擎。,High
2026-01-09 17:41:28,国产高速互联技术集群（含摩尔线程MTLink、华为UB-Mesh、沐曦MetaXLink、壁仞BLink、数渡PCIe交换芯片等）,AI算力基础设施/高速互联芯片,互联技术;芯片设计;高性能计算;AI基础设施;国产替代,成长期至扩张期（各公司不同，A轮至未上市巨头）,6,赛道前景明确（AI算力刚需），但单个创业公司面临极高生态壁垒、激烈竞争和商业化挑战，投资需精挑细选并深度赋能。,High
2026-01-10 10:24:25,可以科技 / Keyi Tech (Loona),消费级机器人 / AI情感陪伴硬件,AI Agent;消费级机器人;情感陪伴;多模态交互;硬件创新,成长/成长期 (B轮或类似),6,具备卓越产品定义和设计能力的硬件团队，切入情感陪伴机器人赛道有先见性，但面临技术、市场验证和商业化的多重高风险。,High
2026-01-10 17:36:23,金宁汇科技,数据要素/产业AI服务,数据资产;AI大科学模型;区块链;新质数字化;产业服务,B轮,7,稀缺的“区块链+垂直AI”政策风口标的，具备先发客户案例，但面临从定制化服务向平台化产品转型的巨大挑战。,Medium
